"","organization"
"398","The three top Democrats in the U.S. House of Representatives  called on Democratic congressman John Conyers on Thursday to resign in light of the sexual harassment allegations he faces, but Conyers' attorney said he was not thinking of stepping do..."
"399","Corrections appearing in print on Tuesday, November 28, 2017."
"400","The Latest on President Donald Trump's ""Pocahontas"" political jab at an event honoring Navajo Code Talkers (all times local):"
"401","Alabama Democrat Doug Jones said Tuesday that Republican Roy Moore is trying to ""dodge"" a discussion of his record and the accusations against him in their U.S. Senate race."
"402","Troy Hunt has collected a trove of 4.8 billion stolen identity records pulled from the darkest corners of the internet &#8212; but he isn't a hacker."
"403","Republicans say their proposals will set off a wave of investment, hiring and raises. But the outlook from the executive suite is not so clear."
"404","Social media gets all the attention for polarization, but TV is doing more than its share."
"405","Following are five big themes likely to dominate thinking of investors and traders in the coming week and the Reuters stories related to them."
"406","President Donald Trump gave embattled GOP Senate candidate Roy Moore a vigorous formal endorsement Monday, looking past allegations of sexual misconduct with Alabama teenagers as Republican leaders in Washington, once appalled by Moore's candidacy..."
"407","President Trump officially recognized Jerusalem as the capital of Israel on Wednesday, reversing decades of American foreign policy."
"408","Hundreds of participants attended the opening of a human rights forum in Beijing on Thursday in the latest installment of China's energetic drive to showcase what it considers the strengths of its authoritarian political system under President Xi ..."
"409","In an extraordinary attack on the top law enforcement body in his own government, President Trump accused the F.B.I. and its career investigators of having a bias against him."
"410","The Latest on FBI Director Christopher Wray's testimony to Congress (all times local):"
"411","Here’s what you need to know to start your day."
"412","House Republicans are embracing the Senate’s repeal of the health law’s mandate that most people have insurance, but they are not buying a side deal to stabilize insurance markets."
"413","The following is the text of an address made by President Donald Trump announcing the recognition by the United States of Jerusalem as Israel's capital."
"414","Essential to Philip D. Murphy’s agenda was a so-called “millionaire’s tax,’’ but legislators are rethinking that plan in light of the federal measure."
"415","In a year full of electoral events, continuity is good news for the region."
"416","The drastic cuts to the protected area of the national monument in Utah are expected to touch off a legal battle that could alter the course of American land conservation."
"417","One of Representative John Conyers Jr.’s accusers appeared on “Today” to explicitly detail her harassment accusations, prompting House leaders to say he should go."
"418","The acting foreign minister, Sigmar Gabriel, calls for a bolder foreign policy role for Berlin, as Germans say they worry more about the U.S. than North Korea or Iran."
"419","The threat of new U.S. sanctions has spread anxiety among Russia's wealthiest people that their association with President Vladimir Putin could land them on a U.S. government blacklist, members of the business elite say."
"420","Lawmakers are scrambling to fix a last-minute provision inserted into the Senate tax bill that could nullify tax breaks many corporations rely on to help fund research."
"421","Dealt a setback on taxes, Senate Majority Leader Mitch McConnell was forced to turn to one of his harshest Republican antagonists to pass the most sweeping tax package in more than three decades."
"422","Impeachment just became a lot more likely."
"423","For all her tough talk, the education secretary has made little progress on priorities like school vouchers and charter schools. Allies blame the storms around the president."
"424","One of the nation’s most significant cultural sites could be at risk from planned oil and gas extraction nearby."
"425","President Trump told Senators Mitch McConnell, Richard Burr and others that he wanted an inquiry into Russian interference in the election to come to a close."
"426","Mr. Cotton, a senator from Arkansas, would be the youngest person ever to run the C.I.A. should a White House plan to shuffle the cabinet come to fruition."
"427","A transcript of President Donald Trump's remarks about formally recognizing Jerusalem as Israel's capital, as delivered at the White House Wednesday."
"428","A veteran of the fight to take a Pacific atoll in World War II, he fought for the return of Marines’ remains and to restore a beach as “hallowed ground.”"
"429","Some lawmakers charged with sexual harassment face intense pressure to resign. Others find more tolerance. There seems to be no rhyme or reason to the responses."
"430","Today in History"
"431","Steven Mnuchin, the Treasury secretary, has promised that an analysis of the tax bill will show robust economic growth, but that report has yet to materialize."
"432","Republicans muscled the largest tax overhaul in 30 years through the Senate early Saturday, taking a big step toward giving President Donald Trump his first major legislative triumph after months of false starts and frustration on other fronts."
"433","The Latest on allegations of sexual misconduct against Rep. John Conyers (all times local):"
"434","For instance, India can teach us the power of digitized data."
"435","Some House Democrats hope that the sexual harassment scandal that cost Representative John Conyers Jr. his Judiciary post could hasten other changes."
"436","Here’s what you need to know to start your day."
"437","Jerome H. Powell, nominated to be the Fed’s next chairman, told senators he would continue the bank’s current path of monetary and regulatory policies."
"438","President Donald Trump on Wednesday shared anti-Muslim videos posted on Twitter by a far-right British party leader, drawing condemnation from Britain, U.S. Muslim groups and some members of Congress."
"439","A federal judge denied an emergency request on behalf of an Obama-era holdover who disputed President Trump’s decision to appoint a new acting director of the Consumer Financial Protection Bureau."
"440","As his company closes in on a deal for much of the Fox media empire, the C.E.O. may have to postpone retirement yet again to oversee post-merger work."
"441","Many mainstream economists say they're appalled by President Donald Trump's threats to trash trade agreements and tax imports in a blunt-force drive to shrink America's bulging trade deficits."
"442","The U.S. trade deficit increased to a nine-month high in October due to rising oil prices and the widening of America's long-standing deficits with China and Mexico."
"443","Sen. Al Franken's announcement Thursday that he will resign sets off a scramble toward a special election in 2018 to finish the Minnesota Democrat's term, with former governor and one-time presidential candidate Tim Pawlenty seen as a top possibil..."
"444","Here’s what you need to know at the end of the day."
"445","Asian shares hovered near two-month lows on Thursday as softer oil and copper prices and uncertainty over U.S. policy kept many investors on the sidelines, even as some high-tech bellwethers bounced back after a searing sell-off."
"446","Earlier this year, President Donald Trump ordered U.S. Interior Secretary Ryan Zinke to conduct an unprecedented review of 27 monuments established by former presidents over more than two decades on lands and waters revered for their natural beaut..."
"447","Congo has a long journey to recovery ahead of it, but with the right combination of business, social and political services there is now optimism for a country that once seemed to have lost any."
"448","Speaking to an audience that included the heads of Apple and Google, Wang Huning said China should be free to govern, and censor, its internet."
"449","U.S. Rep John Lewis announced Thursday that he won't speak at the opening of Mississippi civil rights and history museums, saying it's an ""insult"" that President Donald Trump will attend."
"450","The Center for Public Integrity and The Associated Press analyzed financial disclosure reports from 6,933 state legislators around the country and found that three out of four lawmakers had income from other employment."
"451","Today in History"
"452","Interior Secretary Ryan Zinke on Tuesday recommended President Donald Trump reduce the size and change the management of more national monuments in the western United States, and lashed out at critics of cuts already announced to protected areas i..."
"453","Today in History"
"454","Also: Why lie if you’ve done nothing wrong?"
"455","Health care for a thousand kids, or tax breaks for one wealthy heir? The G.O.P. prefers the second."
"456","Here’s what you need to know at the end of the day."
"457","President Trump has offered lavish praise when the intelligence community or law enforcement investigates his opponents but rebuked them when their actions do not align with his interests."
"458","The Latest on President Donald Trump's decision to shrink two national monuments in Utah (all times local):"
"459","In a story sent Dec. 2 and retransmitted Dec. 3 about the U.S. Army granting waivers to recruits who've used marijuana, The Associated Press erroneously reported that Maryland, rather than Nevada, is among the states that have legalized the sale o..."
"460","Businesses have long claimed the First Amendment should excuse them from complying with the law. The Supreme Court has always rejected that argument."
"461","U.S. Senate Republicans agreed to talks with the House of Representatives on sweeping tax legislation on Wednesday, amid early signs that lawmakers could bridge their differences and agree on a final bill ahead of a self-imposed Dec. 22 deadline...."
"462","Wealthy Russians facing the prospect of targeted U.S. sanctions next year have floated the idea of a special treasury bond to facilitate favourable terms for bringing their cash home, three sources familiar with the scheme said. "
"463","The special counsel investigation into possible coordination between President Donald Trump's campaign and Russia during the 2016 presidential election has cost more than $6.7 million so far, according to a financial report released Tuesday."
"464","Asian stocks slipped on Wednesday, dragged by losses on Wall Street as the technology sector stuttered yet again after a brief rebound, while the dollar sagged on lower long-term U.S. yields."
"465","Insistence on a 20 percent corporate tax rate is slowing negotiations for a final deal in the Senate."
"466","Readers respond."
"467",""
"468","U.S. stocks, the dollar and Treasury yields fell on Friday in a volatile session tied to developments in a probe into Russia's involvement in the U.S. election as well as by progress with a tax bill in Congress."
"469","The U.S. agency tasked with protecting the country from missile attacks is scouting the West Coast for places to deploy new anti-missile defences, two Congressmen said on Saturday, as North Korea's missile tests raise concerns about how the United..."
"470","A raft of Chinese data in coming weeks is expected to show the world's second-largest economy came under growing pressure in November as the government intensified crackdowns on polluting industries and financial risks."
"471","The U.S. agency tasked with protecting the country from missile attacks is scouting the West Coast for places to deploy new anti-missile defenses, two Congressmen said on Saturday, as North Korea's missile tests raise concerns about how the United..."
"472","A generation maligned as entitled whiners will be particularly hard hit by the Republicans’ wretched tax bill."
"473","Mr. Franks, who said he had asked two female staff members to be a surrogate to bear his child, was the third lawmaker to step down from office this week."
"474","A federal judge on Thursday asked Argentina's Senate to allow the arrest of former President Cristina Fernandez on a charge of treason for allegedly covering up the role of Iranians in a 1994 bomb attack on a Jewish center."
"475","President Donald Trump ordered U.S. Interior Secretary Ryan Zinke earlier this year to conduct an unprecedented review of 27 monuments established by former presidents over more than two decades on lands and waters revered for their natural beauty..."
"476","Three federal appeals court judges who blocked President Donald Trump's second travel ban earlier this year had some skeptical questions about his third and latest set of restrictions on travelers from six mostly Muslim nations during oral argumen..."
"477","All of the U.S. military's special operations fighters now being sent to war zones have freeze-dried blood plasma, a crucial addition to first-aid kits that can prevent badly wounded troops from bleeding to death on the battlefield."
"478","Clashes between rebel factions in the Yemeni capital Sanaa continued for a second day on Thursday, with Houthi troops moving against forces loyal to a former president and accusing them of fomenting a coup with the help of the United Arab Emirates..."
"479","The leaders of Germany’s largest parties met to sound out a possible renewed deal weeks after talks on an alternative arrangement fell apart."
"480","The Latest on The Associated Press Newsmaker interview with Sen. Tom Cotton, R-Ark. (all times local):"
"481","Former Gov. Phil Bredesen, the last Democrat to win a statewide election in Tennessee, touted his problem-fixing credentials on Thursday in announcing his bid to succeed Republican Bob Corker in the U.S. Senate."
"482","President Donald Trump changed his story Saturday on why he fired Michael Flynn as his national security adviser, now suggesting he knew at the time that Flynn had lied to the FBI as well as to Vice President Mike Pence about his contacts with Rus..."
"483","A U.S. tax overhaul will increase the government's need to issue more Treasuries as interest costs on the country's debt become a larger drain on the budget."
"484","The U.S. agency tasked with protecting the country from missile attacks is scouting the West Coast for places to deploy new anti-missile defences, two Congressmen said on Saturday, as North Korea's missile tests raise concerns about how the United..."
"485","Ending net neutrality and letting companies charge more, or block, certain services, will enrich them and strangle the web."
"486","Smoked pot? Want to go to war?"
"487","Former Yemeni president Ali Abdullah Saleh said on Saturday he was ready for a ""new page"" in ties with the Saudi-led coalition fighting in Yemen if it stopped attacks on his country, in a move that could pave the way to end nearly three years of w..."
"488","In which Republican donors pick your children’s pockets."
"489","The secretary of state, who may be forced out soon, presided over a historic gutting of the Foreign Service. But his replacement might be worse."
"490","Charles ""Chuck"" Johnson is not the kind of foot soldier in the army of lobbyists that House of Representatives Speaker Paul Ryan warned would descend on Washington to fight the biggest overhaul of the tax code since the 1980s."
"491","Mr. Kimmel lashed out at Mr. Moore, the Republican Senate candidate in Alabama accused of sexual misconduct, after the two tangled on Twitter."
"492","The president is acting more deranged than usual, but Republicans in Congress don’t care."
"493","U.S. Secretary of State Rex Tillerson's expected exit from the  Trump administration is one of many staff changes likely as President Donald Trump nears the end of his first year in office, with sources saying top economic adviser Gary Cohn and  s..."
"494","Charles ""Chuck"" Johnson is not the kind of foot soldier in the army of lobbyists that House of Representatives Speaker Paul Ryan warned would descend on Washington to fight the biggest overhaul of the tax code since the 1980s."
"495","Wall Street took investors on a turbulent ride Friday as stock indexes veered into a steep slide that knocked 350 points off the Dow Jones industrial average before the market eventually clawed back most of its losses."
"496","Melinda and Joel Loshak raised two children in a stylish ranch house in Houston's upscale Meyerland neighborhood and planned to retire there. Now they are hoping the government will knock it down."
"497","U.S. Secretary of State Rex Tillerson's expected exit from the  Trump administration is one of many staff changes likely as President Donald Trump nears the end of his first year in office, with sources saying top economic adviser Gary Cohn and  s..."
"498","The leader of Germany's Social Democrats (SPD) said on Friday he ruled out no option for forming a new government but stressed that a re-run of the outgoing ""grand coalition"" with Chancellor Angela Merkel's conservatives was not a done deal."
"499","In “American Wolf,” Nate Blakeslee chronicles the survival of O-Six and her home’s complex ecosystem."
"500","It's lining up to be another strong year for investors who own homebuilding stocks."
"501","It’s a classic tactic of autocrats."
"502","The Latest on Sen. Al Franken and sexual misconduct allegations (all times local):"
"503","The investigative arm of the U.S. Congress is launching a probe into the safety of increasingly long freight trains being operated by CSX Corp, Union Pacific Corp and other major U.S. railroads to boost profitability, the U.S. Government Accountab..."
"504","The revolving door at the Trump White House was ready to spin again as senior administration officials said on Thursday there is a plan to replace U.S. Secretary of State Rex Tillerson with Central Intelligence Agency chief Mike Pompeo within week..."
"505","Income and gender make a big difference in who winds up inventing."
"506","U.S consumer confidence surged to a near 17-year high in November, driven by a robust labour market, while house prices rose sharply in September, which should underpin consumer spending and boost economic growth."
"507","After 11 weeks in detention, the unnamed suspect still has not appeared before a judge. The courts must move faster."
"508","Bad faith touches every aspect of the G.O.P.’s sales pitch to ram a bill through."
"509","Jerome Powell, President Donald Trump's choice to lead the U.S. Federal Reserve, defended plans to potentially lighten regulation of the financial sector during a controversy-free hearing on his nomination to take over the central bank. "
"510","Imagining a new global identity where the term “minority” is an anachronism."
"511","Garrison Keillor, whose stories of small-town characters entertained legions of public radio listeners for 40 years on ""A Prairie Home Companion,"" became another celebrity felled by allegations of workplace misconduct on Wednesday when Minnesota P..."
"512","New taxes are not the answer. A radical reorientation of their mission is."
"513","The U.S. economy has gathered steam this year and will warrant continued interest rate increases amid a strengthened global recovery, outgoing Federal Reserve Chair Janet Yellen told Congressional leaders on Wednesday in her final scheduled testim..."
"514","The U.S. agency tasked with protecting the country from missile attacks is scouting the West Coast for places to deploy new anti-missile defenses, two Congressmen said on Saturday, as North Korea's missile tests raise concerns about how the United..."
"515","The result of Honduras' presidential election remained in limbo on Tuesday, with a gregarious TV host's surprise lead narrowing sharply, prompting him to call on supporters to take to the streets of the capital to defend the vote."
"516","Trenton Charlson gets playful."
"517","The top Democrat in the House on Thursday called on Michigan Rep. John Conyers to resign in the face of multiple accusations of sexual misconduct. Conyers' lawyer swiftly rejected the request, saying Nancy Pelosi ""sure as hell won't be the one to ..."
"518","President Donald Trump is considering a plan to oust Secretary of State Rex Tillerson, whose relationship has been strained by the top U.S. diplomat's softer line on North Korea and other differences, senior administration officials said on Thursd..."
"519","United States officials weigh in on a dispute that could shape global trading — and the willingness of the United States to remain in the W.T.O."
"520","Speaking at the scene of the one of the climactic confrontations of the civil rights movement, Alabama Democrat Doug Jones on Saturday again made his pitch that Alabama's black and white voters have unified concerns that he can best represent."
"521","Cases decided decades ago have set an absurdly high bar for workers bringing sexual harassment lawsuits."
"522","This is no way to handle a complex piece of legislation, and the Republicans must know it."
"523","Taxing free tuition would harm all graduate students, but it would be devastating for students of color."
"524","The U.S. Senate on Wednesday took a step toward passage of tax legislation that is a top White House priority, setting up a likely decisive vote later this week even though it was unclear if the bill had enough Republican support to become law.Rep..."
"525","The Nasdaq posted its biggest one-day drop in more than three months on Wednesday as investors fled high-flying technology  stocks and shifted to banks and other pockets of the market that could benefit from improving economic conditions, lower re..."
"526","It’s planning to end net neutrality while opposing the Time Warner and AT&T merger. This doesn’t make sense."
"527","Honduras faced a growing election crisis on Wednesday, with its U.S.-friendly president edging ahead in troubled vote count that his centrist rival, a television game show host allied with leftists, has rejected, saying he is being robbed."
"528","Rep. Blake Farenthold, Republican of Texas, settled a sexual harassment suit for $84,000, one of six House settlements funded by taxpayers since 2013."
"529","Conservative groups and lawmakers are lining up against a proposal by Senate Republicans to impose automatic tax increases on millions of Americans &#8212; if their sweeping tax package doesn't grow the economy and raise tax revenues as much as pr..."
"530","Facing a critical Senate vote on his tax overhaul and a crush of December deadlines, President Donald Trump is instead putting the spotlight on a volatile collection of extraneous topics &#8212; anti-Muslim videos, Pocahontas, NFL players who knee..."
"531","The Defense Intelligence Agency is refusing to release a wide array of documents related to former National Security Adviser Michael Flynn, saying that turning them over could interfere with ongoing congressional and federal investigations."
"532","Corruption should be prosecuted. But malleable criminal laws are being used to go after political rivals, and that is dangerous to democracy."
"533","The U.S. economy grew faster than initially thought in the third quarter, notching its quickest pace in three years, buoyed by robust business spending on equipment and an accumulation of inventories."
"534","A law Congress passed to keep itself from spending too much could have consequences for many federal programs."
"535",""
"536","Germany's Social Democrat (SPD) Foreign Minister said on Thursday that his party would not be quick to agree to another grand coalition with Chancellor Angela Merkel's conservatives, as party leaders met with the president in a bid to end politica..."
"537","Jerome Powell, President Donald Trump's pick to be chairman of the Federal Reserve, told senators at his confirmation hearing Tuesday that he believes some bank regulations can be rolled back &#8212; something the administration and Wall Street fa..."
"538","Have you been paying attention to the headlines this week? Take our 10-question quiz and see."
"539","The U.S. economy grew faster than initially thought in the third quarter, notching its quickest pace in three years, buoyed by robust business spending on equipment and an accumulation of inventories."
"540","Today in History"
"541","Mr. Noah said that President Trump might be less likely to support a bill that benefits the rich if he were reminded that former President Barack Obama is among them."
"542","There is ample evidence the president is not working for America first."
"543","Venezuelan state security forces systematically abused opposition protesters detained during months of deadly political unrest earlier this year, Human Rights Watch charged Wednesday."
"544","The Democratic senator of Minnesota announced his plans to resign, a day after a sixth woman accused him of misconduct and dozens of his colleagues called for him to step down."
"545","The election of President Trump, the Women’s March and a flood of sexual assault charges against powerful men have combined to build a wave of political activism among women."
"546","As Republicans in Washington tout a tax plan, Ohio residents are trying to understand how it affects them. For many, well-paying jobs remain the issue."
"547","Signs are being placed across the U.S. to commemorate where those sold into slavery first arrived. Some see it as a counterpoint to Confederate monuments."
"548","The Senate voted along party lines, 52-48, to begin debate on the tax plan, turning the spotlight to debate and amendments."
