"","organization"
"269","Graduate students around the U.S. are staging campus walk-outs and lobbying Congress in an effort to keep their tuition waivers tax-free."
"270","For most of the time Syrian refugee Mohammad Al Zayed has been in the United States, judges have been wrestling with the Trump administration's efforts to impose travel restrictions that he says would keep him from seeing relatives who remain over..."
"271",""
"272","A proposal to create hundreds of new judgeships to undo President Barack Obama’s judicial legacy is wrongheaded and based on false assumptions."
"273","Here’s the bill Congress needs to pass now to improve reporting and keep guns out of dangerous hands."
"274","The agency’s administrator is tearing down environmental protections that his organization should be championing."
"275","The Latest on alleged sexual misconduct by Rep. John Conyers (all times local):"
"276","Republican U.S. Representative Trent Franks said on Thursday he would resign after two female staffers complained that he had discussed surrogacy with them."
"277","A Mexican presidential hopeful and governor of a wealthy border state said he would cut taxes to compete with lower rates in the United States if President Donald Trump's fiscal reform passes Congress, hinting at a broader potential response in Me..."
"278","Dragging its abysmal standards lower, it may throw more money at billionaires to win two crucial votes."
"279","Asian share indexes advanced Friday, guided by Wall Street gains and healthy quarterly economic data from Japan."
"280","The tax overhaul legislation passed by the U.S. Senate jettisoned a long-held Republican goal of repealing the corporate alternative minimum tax (AMT), a move seen as hurting companies that invest heavily in research and development."
"281","The Latest on Republican tax overhaul legislation (all times local):"
"282","The head of Nissan Motor Co.'s operations in North America said Monday that the company is undaunted by congressional efforts to do away with a federal tax credit for plug-in electric vehicles."
"283","The top Democrat on the House intelligence committee says Attorney General Jeff Sessions would not directly answer in a closed-door interview Thursday whether President Donald Trump ever asked him to hinder the Justice Department's investigation i..."
"284","A spate of sexual misconduct accusations against U.S. politicians and other powerful men will force candidates for the November 2018 congressional elections to weigh more carefully than ever whether their past behavior could doom their chances."
"285","U.S. Senate Republicans rammed forward President Donald Trump's tax-cut bill on Tuesday in an abrupt, partisan committee vote that set up a full vote by the Senate as soon as Thursday, although some details of the measure remained unsettled."
"286","The top House Democrat on Saturday called for Nevada Rep. Ruben Kihuen to resign after a former aide accused the first-term lawmaker of repeatedly making sexual advances toward her during the 2016 congressional campaign."
"287","The mediator of U.N.-led Syrian peace talks in Geneva will assess next week whether either side is trying to sabotage the process, he said on Thursday, after President Bashar al-Assad's negotiators said they would turn up five days late."
"288","Over 30 technology companies including Alphabet Inc, Amazon.com Inc and Facebook Inc. on Friday urged a U.S. patent court to disregard drugmaker Allergan Plc's contention that its transfer of some of its patents to a Native American tribe shields ..."
"289","The House Ethics Committee said Thursday it is expanding its investigation into sexual harassment allegations against Republican Rep. Blake Farenthold of Texas."
"290","The children remain in their hearts as they work to prevent future gun violence."
"291","The U.S. Environmental Protection Agency could launch a public debate about climate change as soon as January, Administrator Scott Pruitt said on Thursday, as the agency unwinds Obama-era initiatives to fight global warming."
"292","Sen. Lindsey Graham said Sunday that he believes it's time to start moving the families of American military personnel out of South Korea as North Korea pushes the U.S. closer to a military conflict."
"293","The planned tax cuts may cost the company $20 billion. In theory, investors should be up in arms. But the potential loss is actually pretty helpful."
"294","A bipartisan group of U.S. lawmakers has introduced a bill that would ban agreements to keep sexual harassment and discrimination claims out of court, amid a wave of sexual misconduct allegations against powerful men. "
"295","Former longtime Illinois Rep. John Anderson, who ran for president as an independent in 1980, has died at age 95."
"296","The U.S. Justice Department said on Tuesday that it is  considering a possible ban on certain bump stocks, the attachments that make semiautomatic rifles fire faster and were used in the deadliest mass shooting in modern U.S. history in Las Vegas ..."
"297","More than any other politician, he led the push against Lyndon Johnson’s war — and broke his party in two."
"298","Members of Virginia tribes that count Pocahontas among their ancestors said Tuesday that President Donald Trump should not use her name for political gain."
"299","A Democratic U.S. senator is backing away from a proposed legislative tweak that would have helped big banks lessen their capital burden, according to a statement provided to Reuters on Monday."
"300","Time magazine has named the social movement aimed at raising  awareness about sexual harassment and assault, epitomized by the #MeToo social media hashtag, as the most influential ""person"" in 2017, the publication announced on Wednesday."
"301","U.S. Secretary of State Rex Tillerson said there was no truth in reports that the White House had a plan to fire him and replace him with CIA chief Mike Pompeo."
"302","The Republican-led House easily approved legislation Tuesday that would restrict financial aid that directly benefits the Palestinian Authority until it takes credible steps to end what lawmakers say is a practice of rewarding Palestinians who kil..."
"303","A top Republican senator said Monday his comments were misinterpreted when he defended GOP efforts to scale back the federal estate taxes because it helps those who invest rather than people who spend their money on ""booze or women or movies."""
"304","House Democratic Leader Nancy Pelosi on Monday slammed a Republican bill that would make it easier for gun owners to legally carry concealed weapons across state lines ahead of a House vote later this week. It would be the first action by Congress..."
"305","Five House Republicans in New York and New Jersey who voted for the tax plan are trying to blame state leaders for fostering high-tax environments."
"306","Readers bemoan plans to shrink two national monuments in Utah and to drill near Chaco Canyon."
"307","Courts in the United States cannot put Turkey on trial, Turkish President Tayyip Erdogan said on Saturday, in reference to the case of a Turkish bank executive who has been charged with evading U.S. sanctions on Iran."
"308","The Trump administration has named career diplomat Philip Goldberg to head the all-but-abandoned U.S. embassy in Havana, according to three sources familiar with the matter, at a time of heightened tensions between the United States and Cuba."
"309","Republicans held together and shoved their signature tax overhaul a crucial step ahead Tuesday as wavering GOP senators showed a growing openness. But its fate remained uncertain, and a planned White House summit aimed at averting a government shu..."
"310","The Latest on the nomination of Alex Azar to be health secretary (all times local):"
"311","Ethics committees from the House and Senate requested records on Friday detailing taxpayer-financed payments made over the years to settle claims of sexual harassment, discrimination and other prohibited behavior by members of Congress."
"312","Former White House strategist Steve Bannon told CNN Tuesday he is going to campaign for Alabama Senate candidate Roy Moore at a rally in the state next week, making a strong show of support for the embattled Republican a week before the special el..."
"313","A coalition of Chilean leftist parties on Thursday challenged presidential contender Alejandro Guillier to clarify his social and economic policies, withholding the outright endorsement sought by the center-left candidate."
"314","The Trump administration has named career diplomat Philip Goldberg to head the all-but-abandoned U.S. embassy in Havana, according to three sources familiar with the matter, at a time of heightened tensions between the United States and Cuba."
"315","China will not export its political system, President Xi Jinping told a forum for foreign political groups on Friday, as the ruling Communist Party seeks to boost its global image and take a more assertive international role."
"316","By Damir Sagolj"
"317","Asian countries can cope with interest rate hikes in the United States as long as the moves are gradual and reflect U.S. economic fundamentals, Asian Development Bank (ADB) President Takehiko Nakao said on Thursday. "
"318","An overhaul championed by President Trump and Republican leaders could reshape health care, education and social services."
"319","A subsidiary of an Italian energy company has received a federal permit to drill the first oil exploration wells in U.S. Arctic waters in two years."
"320","Federal prosecutors and lawyers for a former Louisiana congressman who famously hid $90,000 in his freezer are working on an agreement for his resentencing on corruption charges, according to court documents filed in the case."
"321","Yes, it’s dreadful policy. But it will be easier to reverse than other Trump priorities."
"322","A U.S. House panel on Friday approved legislation that would renew the National Security Agency&#8217;s warrantless internet surveillance program, despite objections from the technology sector and civil liberties groups over inadequate privacy pro..."
"323","By denying deductions for state and local taxes, the Republicans seek to force high-tax states run by Democrats to capitulate."
"324","Republican leaders passed the tax bill out of the Senate Budget Committee, clearing the way for it to come to the Senate floor later this week."
"325","Secretary of State Rex Tillerson declared Tuesday he is ""offended"" by the growing number of critical reports of his leadership, which accuse him of dismantling the State Department for political reasons."
"326","Lawyers for Jacob Zuma have until midnight to file papers outlining why nearly 800 corruption charges shelved before he became South African president eight years ago but recently reinstated by the courts should not be brought against him."
"327","President Donald Trump intends to nominate Marvin Goodfriend, a Carnegie Mellon University economics professor, for a seat on the Federal Reserve Board, the latest step in the administration's effort to put its stamp on the nation's central bank."
"328","Your daily look at late-breaking news, upcoming events and the stories that will be talked about today:"
"329","Senator Kirsten Gillibrand was the first in what would become a chorus of Democratic senators to call for their colleague Al Franken to resign."
"330","Republicans rammed a bill through the House on Wednesday that would make it easier for gun owners to legally carry concealed weapons across state lines, the first significant action on guns in Congress since mass shootings in Nevada and Texas kill..."
"331","Laura Russo is just the kind of voter the Republicans need, but the party's proposed tax overhaul, which includes limits on the deductions for mortgage interest, state taxes and property taxes, is pushing her away."
"332","A two-week stopgap measure would provide more time to negotiate, but obstacles loom on both sides of the aisle as lawmakers push their own priorities."
"333","With Republicans’ new ambitions, the bill heading toward completion is not just a tax cut, but the first step toward a long-held vision to undo the New Deal and Great Society."
"334","Senate passage of a trillion-dollar tax cut will be a much-needed Republican victory, but it remains to be seen whether it lifts them out of their political ditch."
"335","The Environmental Protection Agency announced it would not change the rule mandating a rising percentage of ethanol to be blended with gasoline."
"336","The U.S. Senate on Thursday delayed voting on a Republican tax overhaul as the bill was tripped up by problems with an amendment sought by fiscal hawks to address a large expansion of the federal budget deficit projected to result from the measure..."
"337","In less than two weeks, much of the government will run out of money, but a negotiating session at the White House on Tuesday blew up after President Trump attacked Democrats."
"338","Ann Marie Buerkle, a commissioner poised to run the federal agency, has rarely voted for a mandatory recall, a maximum fine, or a tougher safety standard."
"339","The Republican National Committee restored its support for Mr. Moore, the Senate candidate in Alabama who has stabilized in the polls after sexual misconduct accusations."
"340","Three senior Brazilian law enforcement officials, including the former prosecutor general, said new leaders of the federal police and prosecutors' offices are curbing an anti-corruption drive that challenged centuries of impunity in Latin America'..."
"341","The son of former Democratic Rep. John Conyers, who's a possible candidate for his father's vacated U.S. House seat, was arrested in February in Los Angeles after his girlfriend told police he body-slammed and then stabbed her during an argument, ..."
"342","Venezuela's former oil czar resigned as ambassador to the United Nations Tuesday on what he said were orders from President Nicolas Maduro, a sign of growing divisions in the ruling socialist party amid a deepening economic crisis."
"343","South Africa's deputy president got the majority of nominations to become leader of the ruling African National Congress, but the complexity of the leadership race means it's far from certain he will become the next party leader and therefore the ..."
"344","The Latest on tax bills in Congress (all times local):"
"345","The Latest on President Donald Trump's endorsement of Republican Roy Moore in the Alabama Senate race (all times local):"
"346","An Obama administration proposal that would have required airlines disclose checked and carry-on bag fees at the start of a ticket purchase rather than later is being dropped by the Department of Transportation."
"347","Honduran election officials said President Juan Orlando Hernández had won a narrow margin of votes, but international monitors asked for recounts."
"348","The cellphone alert, which went to at least eight million people, was California’s largest use ever of a federal warning system activated in 2012."
"349","Wall Street rose on Thursday, buoyed by popular technology companies including Facebook and Alphabet, while shares of yoga pants seller Lululemon Athletica also worked up a sweat. "
"350","John Anderson, a former Republican congressman who challenged the party's conservative drift by taking on its chief symbol, Ronald Reagan, and ran for president as an independent in 1980, died on Sunday. He was 95."
"351","The Dow Jones Industrial Average reached a record high on Monday, with banks and retailers surging and technology companies falling as investors realigned their portfolios in hopes of benefiting from expected corporate tax cuts."
"352","The United States has formally told the World Trade Organization (WTO) that it opposes granting China market economy status, a position that if upheld would allow Washington to maintain high anti-dumping duties on Chinese goods."
"353","The Interior Department said Thursday it is delaying an Obama-era regulation aimed at restricting harmful methane emissions from oil and gas production on federal lands."
"354","The Pentagon will indefinitely delay a ban on the use of older types of cluster bombs due to take effect on Jan. 1, 2019, officials said, arguing that safety improvements in munitions technology failed to advance enough to replace older stockpiles..."
"355","President Donald Trump's efforts to make the United States ""energy dominant"" with help from Alaska got off to modest results Wednesday."
"356","The Latest on a resolution by a Democratic lawmaker to impeach President Donald Trump (all times local):"
"357","A warm start to the winter has boosted steel prices and margins for mills in China, the world's top producer, as the higher temperatures have allowed projects to proceed that would normally have come to a halt."
"358","North Korea's decision to hold talks with a senior United Nations official, who is also an American citizen and former U.S. diplomat, presents a rare opportunity for both sides to sound each other out in the increasingly isolated North Korean capi..."
"359","The Organization of American States (OAS) said on Wednesday it may call for new Honduran elections if any ""irregularities"" undermine the credibility of results in last month's disputed vote that has sparked a crisis in the Central American nation."
"360","Ms. Brown, a former representative from Florida, was convicted of fraud after using over $300,000 from the charity for personal expenses, including tickets to a Beyoncé concert."
"361","Eight Latin American governments on Wednesday applauded Honduras' willingness to recount disputed votes in the presidential elections, but questions remain about how thorough that recount will be."
"362","The son of former Democratic Rep. John Conyers, who's a possible candidate for his father's vacated U.S. House seat, was arrested in February in Los Angeles after his girlfriend told police he body-slammed and then stabbed her during an argument, ..."
"363","The Senate on Wednesday barreled toward the most sweeping rewrite of the tax code in more than three decades as the top Republican senator said he was willing to compromise on a major sticking point for lawmakers from high-tax states such as New Y..."
"364","President Donald Trump's eldest son and a former business associate of the president are due to testify to the U.S. House of Representatives Intelligence Committee, as it continues its investigation of possible Russian involvement in the 2016 elec..."
"365","U.S. Senate Republicans made last-minute changes to their tax bill to secure enough votes to pass the sweeping legislation on Saturday and move on to negotiations this week on a final measure with Republicans in the House of Representatives."
"366","With more competitive congressional districts, representatives would be more likely to work with the opposing party and listen more closely to their constituents, Democrats suing for a new congressional map in Pennsylvania told a panel of judges o..."
"367","Former U.S. Rep. Corrine Brown, once a powerful Florida Democrat, was sentenced Monday to five years in prison for fraud and other crimes related to a purported charity for poor students that she used as a personal slush fund."
"368","Is Santa Claus coming to town? Wall Street thinks so, even though stocks have already exceeded most expectations this year."
"369","Ali Abdullah Saleh, the former president of Yemen, said he was ready for a “new page” in ties with the Saudi-led coalition if it stopped attacks on his country."
"370","U.S. Senate Republicans made last-minute changes to their tax bill to secure enough votes to pass the sweeping legislation on Saturday and move on to negotiations this week on a final measure with Republicans in the House of Representatives."
"371","Americans are signing up in growing numbers for the Affordable Care Act's subsidized health insurance, the government said Wednesday. But with enrollment season cut in half and just over a week to go, experts say the final tally will likely fall s..."
"372","President Trump nominated Marvin Goodfriend, an economist at Carnegie Mellon University, to an open seat on the Federal Reserve’s board."
"373","The leaders of Germany's Social Democrats (SPD) agreed on Monday to enter talks with Chancellor Angela Merkel's conservatives on forming a government that could end political deadlock in Europe's largest economy."
"374","President Donald Trump's administration announced Friday that it won't require mining companies to prove they have the financial wherewithal to clean up their pollution, despite an industry legacy of abandoned mines that have fouled waterways acro..."
"375","President Donald Trump lashed out Friday after a jury acquitted a Mexican man in the killing of a woman on a San Francisco pier, calling the verdict ""disgraceful"" and suggesting Democrats will pay a price for being ""weak on Crime."""
"376","You don’t need to be an expert in tax policy to get caught up on what the far-reaching proposal could mean."
"377","“Annie Leibovitz: Portraits 2005-2016” collects images of influence from all corners of contemporary culture."
"378","Wall Street fell on Friday, whipsawed by developments with a probe into Russia's alleged involvement in the U.S. election as well as with progress on a tax bill in Congress."
"379","The U.S. government is considering setting new payment methods aimed at curbing costs for Medicare and Medicaid coverage of breakthrough medical treatments with very high prices, particularly novel gene-based therapies for cancer and other disease..."
"380","U.S. Special Counsel Robert Mueller's office has spent about $3.2 million in the first 4-1/2 months of its investigation into Russian meddling in the 2016 presidential election, the Justice Department revealed in a report on Tuesday."
"381","U.S. Republicans in Congress are grappling with a thorny question about corporate taxes as they work to reconcile competing tax bills from the Senate and House of Representatives into a unified measure that they hope President Donald Trump will si..."
"382","Two days after a federal court endorsed President Donald Trump's deregulatory pick for a consumer watchdog, a rival official was encouraging agency staff to keep up the pressure on the lending industry, several current and former officials said on..."
"383","Democrats in Congress are pushing for investigations into how the Federal Emergency Management Agency awarded contracts worth $30 million to a fledgling company for Hurricane Maria disaster supplies that it failed to deliver to Puerto Rico."
"384","A judge on Thursday denied an emergency request for relief funds by three Texas churches damaged during Hurricane Harvey that are suing the federal government over how it offers disaster aid to houses of worship."
"385","The U.S. government is considering setting new payment methods aimed at curbing costs for Medicare and Medicaid coverage of breakthrough medical treatments with very high prices, particularly novel gene-based therapies for cancer and other disease..."
"386","New orders for U.S.-made goods fell less than expected in October and shipments of core capital goods were much stronger than previously reported, pointing to sustained strength in manufacturing that should buoy the economy."
"387","Democratic U.S. congressman John Conyers faced increasing pressure to resign on Wednesday, with the No. 2 Democrat in the House of Representatives saying he should step aside if sexual harassment accusations against him were true."
"388","A proposal to amend a tax bill in the U.S. Senate with a trigger to automatically reverse tax cuts if new revenues fall short of forecasts could further pressure businesses and the economy if the economy slows, critics said on Wednesday."
"389","A conservative activist who for years exchanged online messages with Texas Republican Rep. Joe Barton says that when he occasionally steered the topic toward sexual themes, she long dismissed it as ""that's just Joe."""
"390","Alex Azar, a former drug industry executive and lobbyist nominated to run the U.S. Department of Health and Human Services, promised on Wednesday to lower drug prices and said he was unaware of any efforts to sabotage the healthcare law passed und..."
"391","A former navy captain known as the ""Angel of Death"" was sentenced Wednesday to life in prison for human rights violations committed at a notorious clandestine detention and torture center during Argentina's 1976-1983 dictatorship."
"392","Readers worry that eliminating rules that ensure a level playing field will allow internet gatekeepers to abuse their power and play favorites."
"393","The rugged “Vikings” returns for its fifth season. And “The Marvelous Mrs. Maisel” arrives for streaming."
"394","An Air Force Academy office that was supposed to help sexual assault victims was crippled by infighting, poor management, rumors and shoddy record-keeping, an internal investigation found."
"395","A small Montana company that landed and lost a $300 million contract to restore Puerto Rico's hurricane-shattered electric grid has sued a subcontractor for allegedly interfering with tens of millions of dollars in payments."
"396","The United States has formally told the World Trade Organization (WTO) that it opposes granting China market economy status, a position that if upheld would allow Washington to maintain high anti-dumping duties on Chinese goods."
"397","Venezuela ""systematically"" abused anti-government protesters this year, two rights groups said on Wednesday, including through beatings, firing tear gas canisters in closed areas and forcing detainees to eat food tainted with excrement."
