"","organization"
"136","The Yellow Ribbon program depends on help from private schools. A tax on endowments could threaten that."
"137","Germany's Social Democrats (SPD) leader will try on Thursday to convince a reluctant party that it has a duty to discuss forming a government under conservative Chancellor Angela Merkel, for the sake of German and European stability."
"138","German Foreign Minister Sigmar Gabriel will on Tuesday urge his country to become more assertive on foreign policy issues and less dependent on the United States, according to excerpts of a speech he is due to give, cited by the newspaper Sueddeut..."
"139","Nepalis began voting in the final round of parliamentary elections on Thursday, a key step to complete a near decade-long democratic transition after the abolition of the centuries-old monarchy and the end of a civil war against Maoist guerrillas."
"140","U.S. House of Representatives Democratic leader Nancy Pelosi said on Thursday her party would not support a short-term funding bill being brought up for a vote later in the day because it did not include any key Democratic priorities."
"141","Indian Prime Minister Narendra Modi was in the final phase of campaigning on Thursday to retain power in his home state and stave off the most serious challenge yet from a combined opposition."
"142","Members of Venezuela's government and opposition coalition failed to reach a deal in a new round of talks in the Dominican Republic on Saturday aimed at resolving the OPEC nation's protracted political crisis, but planned to meet in two weeks to t..."
"143","Readers discuss whether President Trump could be charged with obstruction of justice."
"144","The U.S. State Department has certified that the Honduran government has been fighting corruption and supporting human rights, clearing the way for Honduras to receive millions of dollars in U.S. aid, a document seen by Reuters showed."
"145","Conservative Arizona Republican Rep. Trent Franks is resigning from Congress, two GOP strategists said Thursday, the third lawmaker to announce his resignation this week."
"146","The congressional clock is running out as a handful of bills are batted around Capitol Hill to reauthorize a critical foreign intelligence collection program that expires in four weeks."
"147","Four supporters of Yemen's former president Ali Abdullah Saleh were killed in clashes with their supposed allies from the Houthi movement in the center of the capital Sanaa on Wednesday, his party said."
"148","U.S. Senate Republicans were considering a raft of last-minute changes to their sweeping tax bill on Friday, as they edged toward a final vote that could move Congress to year-end enactment of tax cuts for businesses and individuals."
"149","Republicans lined up a vote next week in the House on making it easier for gun owners to legally carry concealed weapons across state lines, the first gun-related legislation since mass shootings in Nevada and Texas killed more than 80 people."
"150","The U.S. State Department has certified that the Honduran government has been fighting corruption and supporting human rights, clearing the way for Honduras to receive millions of dollars in U.S. aid, a document seen by Reuters showed."
"151","The Latest on the U.S. Senate race in Alabama (all times local):"
"152","Germany should be more assertive in setting foreign policy according to its own interests rather than to those of the United States, the German foreign minister said on Tuesday. "
"153","Football Federation Australia's embattled chairman Steven Lowy believes a FIFA takeover of Australian soccer would be a ""reputational"" black eye for the sport but hopes to work with the global governing body to resolve a festering power struggle."
"154","U.S. Senate Republicans were considering a raft of last-minute changes to their sweeping tax bill on Friday, as they edged toward a final vote that could move Congress to year-end enactment of tax cuts for businesses and individuals."
"155","The Latest on Fed Chair Janet Yellen's testimony to the Joint Economic Committee (all times local):"
"156","Opposition has grown among Americans to a Republican tax plan before the U.S. Congress, with 49 percent of people who were aware of the measure saying they opposed it, up from 41 percent in October, according to a Reuters/Ipsos poll released on We..."
"157","The Times’s editorial board asked readers to call their senators and express their disapproval of the tax bill. But some thought this blurred a line."
"158","A group of Republicans in the U.S. House of Representatives on Wednesday urged keeping federal tax breaks on private activity bonds sold by the developers of hospitals, nursing homes, airports and toll roads to reduce costs."
"159","Puerto Rico would get substantial debt relief and other new aid to help it recover from destruction inflicted by Hurricanes Irma and Maria in September, under legislation unveiled on Tuesday by leading liberals in the U.S. Senate."
"160","Some of Democratic U.S. Representative John Conyers' colleagues in the Congressional Black Caucus (CBC) are pressing the 88-year-old lawmaker to resign amid sexual harassment allegations against him, two senior House Democratic aides said on Tuesd..."
"161","TC Bell knows what life is like without health insurance after growing up with a mother who cobbled together care from a public health clinic, emergency room visits and off-the-books visits to a doctor they knew."
"162","President Trump’s tweet that he knew his former national security adviser had lied to the F.B.I. is seen by some as evidence that he obstructed justice. But his lawyer says a president cannot violate such laws."
"163","They don't do tax reform like they used to."
"164","Germany's Social Democrats (SPD) voted on Thursday to hold talks with Chancellor Angela Merkel's conservatives on forming a government after their leader made an impassioned plea for a free hand to work for a social ""United States of Europe""."
"165","President Donald Trump on Wednesday again raised the possibility of a U.S. government shutdown - blaming Democrats for that possible outcome - one day before he is due to host Republican and Democratic congressional leaders for talks on spending b..."
"166","President Trump trusts Ms. Conway. Is that enough to get something done on the opioid addiction crisis?"
"167","Eliminating the individual mandate will likely mean the end of affordable care for all."
"168","President Donald Trump and congressional leaders have scheduled a summit to begin sorting out their budget differences, top lawmakers and the White House said Monday, as a clash that could produce a partial government shutdown by the weekend hung ..."
"169","Top Republicans tried quelling GOP divisions over the budget and a partisan immigration clash simmered in the background as leaders labored Tuesday to push a short-term spending bill through Congress by week's end and avert a partial government sh..."
"170","President Donald Trump on Wednesday again raised the possibility of a U.S. government shutdown - blaming Democrats for that possible outcome - one day before he is due to host Republican and Democratic congressional leaders for talks on spending b..."
"171","With its spacious bar and banks of TVs tuned to all-sports stations, the lounge at New Jersey's Monmouth Park Racetrack is a sports gamblers' paradise-in-waiting. All that's standing in its way: a 25-year-old federal law that bars betting on sport..."
"172","A key House committee on Wednesday approved a Republican bill to expand gun owners' rights &#8212; the first gun legislation since mass shootings in Las Vegas and Texas killed more than 80 people."
"173","Senate Republicans’ tax cut would not pay for itself, according to a new report by the nonpartisan Joint Committee on Taxation."
"174","This is a very bad year."
"175","The Trump administration’s proposed deep budget cuts to the State Department and failure to fill key diplomatic posts threaten the country’s security."
"176","Janet L. Yellen, the Federal Reserve chairwoman, told Congress that economic growth broadened in recent months, but could be doing better."
"177","Conservative and liberal U.S. Supreme Court justices on Tuesday appeared reluctant to broaden protections for corporate insiders who blow the whistle on securities law violations or fraud by their companies."
"178","At a Supreme Court argument on Tuesday, the justices focused on a narrow definition of “whistle-blower” in the Dodd-Frank Act."
"179","Fight for the Future, a scrappy 10-person nonprofit, has helped lead the uproar against changes to internet rules, including hundreds of protests on Thursday."
"180","The Latest on sexual misconduct allegations against Rep. John Conyers (all times local):"
"181","More than three months after Hurricane Harvey walloped Texas, many affected residents say they're still not getting help they need and President Donald Trump is getting low marks for his handling of the disaster, according to a Kaiser Family Found..."
"182","President Donald Trump endorsed U.S. Senate candidate Roy Moore on Monday, throwing his weight behind the embattled Alabama Republican before a special election next week that has been rocked by allegations of sexual misconduct against Moore."
"183","Readers worry about their taxes rising so the wealthy can pay less. One calls on Democrats to not just denounce the G.O.P. plan but offer their own."
"184","Germany's center-left Social Democrats agreed Thursday to open talks with Chancellor Angela Merkel's conservatives on whether to renew their governing coalition or at least to support a minority government."
"185","Less than 24 hours after Donald Trump took office, his presidency started generating controversy. "
"186","Surging stock prices and steady increases in home values powered American household wealth to $96.9 trillion this fall, The Federal Reserve said Thursday. The gains, however, aren't widely shared."
"187","Robert S. Mueller III, the special counsel investigating the Trump campaign’s ties to Russia, spent almost $7 million in its first four and a half months, he said."
"188","Judges have been asked repeatedly to decide whether the lawmakers in charge of drawing congressional district lines have gone too far to favor their parties."
"189","South Africa's ruling African National Congress (ANC) is doing everything possible to avoid a split in the party after elections for a new leader this month, a senior official running for the top job said on Wednesday."
"190","President Donald Trump's weekend remark about a scaled-back tax cut for corporations sparked behind-the-scenes debate in the U.S. Congress, with a White House aide trying on Thursday to minimize the impact of the president's comment."
"191","Stand by him now, stay linked to him forever."
"192","U.S. Supreme Court justices expressed skepticism on Monday over whether ancient Persian artifacts held in a Chicago museum can be seized to pay for a $71 million court judgment against Iran won by several Americans injured in a 1997 Jerusalem bomb..."
"193","Members of the anti-immigrant Alternative for Germany (AfD) party elected a right-wing nationalist to be their co-leader on Saturday, signaling a possible toughening of tone before regional votes next year."
"194","Violent clashes between rival factions in Yemen's rebel-held capital continued Saturday for the fourth straight day as forces loyal to a former president and Iran-backed Shiite rebels known as Houthis faced off in the streets of Sanaa, signaling d..."
"195","The sweeping tax overhaul that passed the U.S. Senate on Saturday contains the Republicans' biggest blow yet to former President Barack Obama's healthcare law, repealing the requirement that all Americans obtain health insurance."
"196","The U.S. House of Representatives ethics committee has begun a sweeping probe into possible sexual harassment and discrimination by the chamber's 434 lawmakers and their staff, requesting on Friday a wide range of documents from the congressional ..."
"197","Members of Venezuela's leftist government and opposition coalition began a new round of talks in the Dominican Republic on Friday aimed at resolving the OPEC nation's long-running and often bloody political standoff."
"198","Peter Baker’s “Obama: The Call of History” is a tribute to a man and an office."
"199","Sen. Al Franken of Minnesota announced on Thursday that he will resign in the face of multiple allegations of sexual misconduct. He joins a long list of lawmakers ousted by scandal."
"200","A prominent Chinese general under investigation for corruption has committed suicide, state media said on Tuesday, the latest development in a sweeping anti-graft campaign that has shaken the armed forces."
"201","U.S. Democratic Representative Luis Gutierrez, who has announced he will not seek re-election to Congress in 2018, said on Wednesday he wanted to concentrate his energies ""on the national level"" and indicated he might be interested in a presidenti..."
"202","A Republican congressman from Florida said Tuesday he won't support a year-end spending measure unless Congress passes a solution for immigrants brought into the country illegally as children."
"203","A group of bipartisan lawmakers introduced legislation Tuesday to combat online sexual exploitation, just a week after the leak on social media of an explicit photo of a Republican congressman from Texas."
"204","The pace at which China is announcing deleveraging reforms has taken markets by surprise. [L3N1NX2J7] Below is a list of its most significant moves:"
"205","South African Deputy President Cyril Ramaphosa has received the most nominations for leader of the ruling African National Congress (ANC) ahead of a party vote this month, voting data from the country's nine provinces show."
"206","More than half the ballots cast in Bolivia's judicial elections on Sunday were spoiled, or nullified, by voters, a sign that the opposition said showed dwindling support for President Evo Morales."
"207","Minnesota's biennial budget faces a deficit for the first time since 2013 as state revenue is expected to fall while expenditures climb, according to a forecast released on Tuesday."
"208","South Africa and Morocco will resume diplomatic ties more than a decade after Morocco withdrew its ambassador from Pretoria, South African President Jacob Zuma said in a newspaper interview published on Sunday."
"209","Russian lawmakers are to discuss a proposal to bar representatives of U.S. media organizations from accessing the lower house of parliament, RIA news agency quoted the chair of one of the chamber's committees as saying."
"210","Mr. Ford, a former congressman turned Wall Street rainmaker, was terminated by the financial services firm for behavior it said was “inconsistent with our values and in violation of our policies.”"
"211","The U.S. House of Representatives voted on Tuesday to sharply reduce the annual $300 million in U.S. aid to the Palestinian Authority unless it take steps to stop making what lawmakers described as payments that reward violent crime."
"212","The Supreme Court declined to hear a lawsuit filed by minor league baseball players accusing Major League Baseball of colluding to suppress wages, leaving intact a District Court ruling that dismissed the case."
"213","A group of 34 House Republicans on Tuesday asked Speaker Paul Ryan to act this month on legislation dealing with the 800,000 young immigrants brought to the United States as children and living here illegally."
"214","Financial markets quarterly trading revenue at JPMorgan Chase &amp; Co is running about 15 percent lower than a year earlier, Chief Financial Officer Marianne Lake said on Tuesday at an investor conference."
"215","The question of whether U.S. Representative John Conyers may resign in the face of sexual harassment allegations will be addressed in the ""next day or so,"" an attorney for the congressman said on Friday."
"216","When the Joint Committee on Taxation found the Republican tax bill would balloon the budget deficit, Republicans tried to discredit it."
"217","Groups like the Koch-funded Americans for Prosperity are trying to convince ordinary Americans that this is good for them too."
"218","Members of Germany's center-left Social Democrats aired differences Tuesday over whether to renew their governing coalition with conservative Chancellor Angela Merkel, while the right of migrants to bring relatives to Germany resurfaced as a poten..."
"219","The premier of Germany's most populous state has become the most senior member of Chancellor Angela Merkel's conservative bloc to throw his weight behind French President Emmanuel Macron's proposals for deepening and reforming the European Union."
"220","China will ""significantly"" widen market access for foreign investors, state radio on Wednesday quoted vice premier Wang Yang as saying, following a recent move to raise foreign ownership limits in local financial firms."
"221","The nomination to be ambassador to Singapore of K.T. McFarland, a former security adviser to President Donald Trump, has been delayed due to concerns about her testimony to Congress over communications with Russia, the chairman of the Senate Forei..."
"222","The Latest on the budget battle in Congress (all times local):"
"223","Your daily look at late-breaking news, upcoming events and the stories that will be talked about Wednesday:"
"224","In a story Dec. 5 about taxes, The Associated Press reported erroneously the name of the Committee for a Responsible Federal Budget."
"225","Brazil's prosecutor general officially presented money laundering and criminal association charges against six people, including a former federal minister and a congressman, Brazilian media reported on Monday evening."
"226","A group of Mexican opposition senators proposed a constitutional reform on Wednesday that would enable a sitting president to face trial for corruption for up to three years after leaving office, in a bid to bolster the fight against graft."
"227","Russian President Vladimir Putin said on Wednesday a complete victory had been achieved over Islamic State militants on both banks of the Euphrates river in Syria."
"228","The International Olympic Committee (IOC) on Wednesday said it would not make any payments to the international boxing federation AIBA until problems over governance and finances are sorted out."
"229","Members of a rising nationalist party in Germany elected their leadership Saturday at a convention in the city of Hannover that was overshadowed by protests."
"230","The plea raised uncomfortable questions about what the former national security adviser might be telling the special counsel, Robert S. Mueller III."
"231","U.S. President Donald Trump plans to nominate Jelena McWilliams, Fifth Third Bancorp's top attorney, to serve as the next head of the Federal Deposit Insurance Corporation, the White House said on Thursday."
"232","The House Benghazi committee used $150,000 in taxpayer money to settle a lawsuit filed by a former aide who alleged he was fired in part because he was not willing to focus his investigative work on Hillary Clinton, documents released Friday show."
"233","The National Academy of Sciences called on the federal government to make drastic policy changes to bring down the cost of prescription medicines."
"234","President Donald Trump will not announce a decision on Monday on whether he will again delay moving the U.S. embassy in Israel to Jerusalem, a White House spokesman said, despite Monday's deadline for doing so."
"235","U.S. Republican Representative Joe Barton of Texas will not seek re-election, his office said in a statement on Thursday, in a decision he made after a nude picture of him appeared on the internet earlier this month."
"236","The Latest on a trial challenging Pennsylvania's congressional district map (all times local):"
"237","Three fighters from forces loyal to the former Yemeni president Ali Abdullah Saleh were killed in a second day of clashes with their own allies from the Houthi movement in the capital Sanaa, Saleh's party said on Thursday."
"238","Shares of the biggest U.S. banks rose on Monday, after the Senate approved a tax overhaul bill on Saturday, raising investor hopes that their earnings would get a boost from a  significantly lower tax bill."
"239","He spurned several job offers from Lyndon Johnson before finally accepting the role of White House gatekeeper, though without the chief of staff title."
"240","The party, which criticized the growth of the federal debt under President Barack Obama, has rallied behind a tax cut that would send it to new heights."
"241","Mainstream lawyers and law professors in China are taking a risk in speaking out against a move that they say would violate the country’s Constitution."
"242","Vice President Mike Pence said Tuesday that President Donald Trump is ""actively considering when and how"" to move the U.S. Embassy from Tel Aviv to Jerusalem, a decision fiercely opposed by the Palestinians."
"243","Your daily look at late-breaking news, upcoming events and the stories that will be talked about Tuesday:"
"244","Weak U.S. inflation is not troubling even in the face of full employment, one of the Federal Reserve's more influential policymakers said on Monday, reinforcing the central bank's mantra that it is gradually raising interest rates. "
"245","Something in Brazil has snapped."
"246","China has embraced globalization, aiming to become an example for emerging economies."
"247","Republican leaders in Washington are coming to grips with the possibility &#8212; perhaps even probability &#8212; that Alabama's Roy Moore will win his special election next Tuesday and join them in the capital."
"248","President Donald Trump on Monday shrank two wilderness national monuments in Utah by at least half in the biggest rollback of public land protection in U.S. history, drawing praise from pro-development lawmakers and a lawsuit from environmentalist..."
"249","The tax overhaul Republicans are pushing toward final votes in Congress could undermine the Affordable Care Act's health insurance markets and over time add to the financial squeeze on Medicare."
"250","A decrease in arrests at the border shows that the administration’s deterrence efforts are effective, Homeland Security officials said."
"251","Three Democratic leaders are still railing, and rallying, against the G.O.P. legislation, saying its impact would be devastating to their states."
"252","The Flynn deal opens the door to charges against the president’s inner circle — and his family."
"253","Seeking to bolster the ailing U.S. Postal Service, federal regulators moved on Friday to allow bigger jumps to stamp prices beyond the rate of inflation, a move that could eventually add millions more dollars to companies' shipping rates from pres..."
"254","The leader of Germany's Social Democrats (SPD) said on Monday he would launch talks with Chancellor Angela Merkel's conservatives on forming a government next week if members of his centre-left party gave him the green light at a congress this wee..."
"255","Senate Republicans rallied around a U.S. tax overhaul bill on Friday, with Maine moderate Susan Collins announcing her support for it after obtaining agreements for several changes, giving the sweeping legislation sufficient votes to win passage."
"256","John Conyers III, whose father endorsed him for a House seat he resigned amid harassment allegations, was arrested in February after his girlfriend suffered knife cuts during an argument."
"257","That gun bill is back, but then again, there’s a hero cat."
"258","A federal law barring states from authorizing commercial wagering on sports seemed to be in trouble at the Supreme Court."
"259","Testing the resolve of Democrats, Senate Majority Leader Mitch McConnell declared Sunday there won't be a government shutdown this week over the question of protecting immigrants brought to the country illegally as children, describing it as a ""no..."
"260","President Trump said he was the “opposite of an exaggerator” before falsely claiming the tax cut “is not good for me” and would be the largest in history."
"261","The president plans to repeal protections on as much as two million acres of public land in Utah."
"262","President Donald Trump said Sunday in a tweet that he never asked former FBI Director James Comey to stop investigating his ex-national security adviser Michael Flynn, issuing a fresh denial amid a shifting timeline on when he may have known that ..."
"263","Wall Street's fear of missing out on a relentless rally appears to be trumping rising political risk in a high-stakes December in Washington. "
"264","Many U.S. flight attendants lack the training in how to deal with complaints of on-board sexual harassment, an industry union and Democratic lawmakers say, raising questions about whether airlines are prepared to protect passengers from predatory ..."
"265","Wall Street banks and big regional lenders are scrambling to secure changes to a U.S. Senate bill easing rules on smaller banks ahead of a key lawmaker meeting next week, several bank lobbyists told Reuters."
"266","The Latest on the Senate confirmation hearing of Jerome Powell, President Donald Trump's nominee for Federal Reserve chairman (all times local):"
"267","Here are some of the top differences that must be resolved before the legislation can be signed into law."
"268","The discussions being held among Republican lawmakers come one day before the Senate is expected to vote to begin the process of aligning its bill with the House-passed legislation."
